id,content,created_at,is_deleted,is_edited,updated_at,author_id,parent_post_id,thread_id
1,"Mam,For how much bit,we have to design this Encoder?",2025-08-07 08:14:33.328404,f,f,2025-08-07 08:14:33.32845,107,,1
2,You will design it for 8 bit,2025-08-07 08:15:23.694233,f,f,2025-08-07 08:15:23.694272,77,1,1
3,"Mam,can we use logisim to simulate the assignment  ?",2025-08-07 08:17:52.32981,f,f,2025-08-07 08:17:52.329863,60,,1
4,Obviously you can.,2025-08-07 08:19:25.040298,f,f,2025-08-07 08:19:25.04036,77,3,1
5,You can also use Proteus and Ngspice,2025-08-07 08:39:10.461472,f,f,2025-08-07 08:39:10.461529,4,3,1
6,Is it a hardware Project?Sir,2025-08-07 09:34:36.176188,f,f,2025-08-07 09:34:36.176223,107,,2
7,Yes.,2025-08-07 09:36:16.054734,f,f,2025-08-07 09:36:16.054804,4,6,2
